{
  "schema_version": "1.0.0",
  "detected_at": "2026-01-01T00:00:00.000Z",
  "environment": {
    "node_version": "v20.0.0",
    "package_manager": "npm",
    "os": "linux",
    "shell": "/bin/bash"
  },
  "git": {
    "available": true,
    "branch": "main",
    "clean": true,
    "has_remote": true
  },
  "docker": {
    "available": true,
    "version": "24.0.0"
  },
  "graphify": {
    "available": false
  },
  "obsidian": {
    "configured": false,
    "vault_path": null
  },
  "buildloop": {
    "yml_present": true,
    "manifest_present": false,
    "ci_workflows": [".github/workflows/ci.yml"],
    "gate_runner_available": true
  },
  "recommended_action": "Run buildloop gates to validate your quality pipeline."
}
